{
  "schemaVersion": 1,
  "id": "lean@1",
  "description": "Proposed three-skill ECC discovery kernel. Remaining skills are routed; this profile does not activate or modify a harness.",
  "registryId": "skill-registry@1",
  "selection": {
    "eager": ["skill:configure-ecc", "skill:context-budget", "skill:ecc-guide"],
    "required": ["skill:configure-ecc", "skill:context-budget", "skill:ecc-guide"],
    "remainder": "routed"
  },
  "budget": { "tokens": 8000, "mode": "blocking" }
}
